{
  "ok": true,
  "status": "done",
  "phase": "read",
  "summary": "3D view around 34 ceilings on Level 2, about 42 m × 18 m.",
  "handle": "h_7f3a91c2",
  "image": {
    "media_type": "image/png",
    "base64": "iVBORw0KGgoAAAANSUhEUgAAAEAAAAAgCAIAAAAt/+nTAAAPtUlEQVR42g3PgcbyCgCA4XM5v4iIREQkIiISY5SMUlKalGJUjFEySkl5k1KMijFKRikpJSK6m/M9d/D890/AIeAUcAm4BTwCXgGfgF8gIBAUCAmEBSICUYGYQFwgISAIiAJJgbSAJJARyAkUBEoCZYGKQE2gIaAINAXaAqqAJtAR6AnoAn2BocBYYCqAwFxgKbAWMAQ2AjsBU8AS2AscBWyBk8BF4CbwEHgKvAU+Al+Bn8B//0QcIk4Rl4hbxCPiFfGJ+EUCIkGRkEhYJCISFYmJxEUSIoKIKJIUSYtIIhmRnEhBpCRSFqmI1EQaIopIU6QtoopoIh2Rnogu0hcZioxFpiKIzEWWImsRQ2QjshMxRSyRvchRxBY5iVxEbiIPkafIW+Qj8hX5iX+BFI4UzhSuFO4UnhTeFL4U/hSBFMEUoRThFJEU0RSxFPEUiRRCCjFFMkU6hZQikyKXopCilKKcopKilqKRQknRTNFOoabQUnRS9FLoKfophinGKaYpSDFPsUyxTmGk2KTYpTBTWCn2KY4p7BSnFJcUtxSPFM8U7xSfFN8Uv9RfQMIh4ZRwSbglPBJeCZ+EXyIgEZQISYQlIhJRiZhEXCIhIUiIEkmJtIQkkZHISRQkShJliYpETaIhoUg0JdoSqoQm0ZHoSegSfYmhxFhiKoHEXGIpsZYwJDYSOwlTwpLYSxwlbImTxEXiJvGQeEq8JT4SX4mf9BfI4sjizOLK4s7iyeLN4svizxLIEswSyhLOEskSzRLLEs+SyCJkEbMks6SzSFkyWXJZCllKWcpZKllqWRpZlCzNLO0sahYtSydLL4uepZ9lmGWcZZqFLPMsyyzrLEaWTZZdFjOLlWWf5ZjFznLKcslyy/LI8szyzvLJ8s3yy/4F8jjyOPO48rjzePJ48/jy+PME8gTzhPKE80TyRPPE8sTzJPIIecQ8yTzpPFKeTJ5cnkKeUp5ynkqeWp5GHiVPM087j5pHy9PJ08uj5+nnGeYZ55nmIc88zzLPOo+RZ5Nnl8fMY+XZ5znmsfOc8lzy3PI88jzzvPN88nzz/PJ/gSKOIs4iriLuIp4i3iK+Iv4igSLBIqEi4SKRItEisSLxIokiQhGxSLJIuohUJFMkV6RQpFSkXKRSpFakUUQp0izSLqIW0Yp0ivSK6EX6RYZFxkWmRSgyL7Issi5iFNkU2RUxi1hF9kWORewipyKXIrcijyLPIu8inyLfIr/iX0DGIeOUccm4ZTwyXhmfjF8mIBOUCcmEZSIyUZmYTFwmISPIiDJJmbSMJJORyckUZEoyZZmKTE2mIaPINGXaMqqMJtOR6cnoMn2ZocxYZiqDzFxmKbOWMWQ2MjsZU8aS2cscZWyZk8xF5ibzkHnKvGU+Ml+Zn/wXqOKo4qziquKu4qnireKr4q8SqBKsEqoSrhKpEq0SqxKvkqgiVBGrJKukq0hVMlVyVQpVSlXKVSpValUaVZQqzSrtKmoVrUqnSq+KXqVfZVhlXGVahSrzKssq6ypGlU2VXRWzilVlX+VYxa5yqnKpcqvyqPKs8q7yqfKt8qv+Beo46jjruOq463jqeOv46vjrBOoE64TqhOtE6kTrxOrE6yTqCHXEOsk66TpSnUydXJ1CnVKdcp1KnVqdRh2lTrNOu45aR6vTqdOro9fp1xnWGdeZ1qHOvM6yzrqOUWdTZ1fHrGPV2dc51rHrnOpc6tzqPOo867zrfOp86/zqfwEFh4JTwaXgVvAoeBV8Cn6FgEJQIaQQVogoRBViCnGFhIKgICokFdIKkkJGIadQUCgplBUqCjWFhoKi0FRoK6gKmkJHoaegK/QVhgpjhakCCnOFpcJawVDYKOwUTAVLYa9wVLAVTgoXhZvCQ+Gp8Fb4KHwVfspfoIWjhbOFq4W7haeFt4Wvhb9FoEWwRahFuEWkRbRFrEW8RaKF0EJskWyRbiG1yLTItSi0KLUot6i0qLVotFBaNFu0W6gttBadFr0Weot+i2GLcYtpC1rMWyxbrFsYLTYtdi3MFlaLfYtjC7vFqcWlxa3Fo8WzxbvFp8W3xa/1F1BxqDhVXCpuFY+KV8Wn4lcJqARVQiphlYhKVCWmEldJqAgqokpSJa0iqWRUcioFlZJKWaWiUlNpqCgqTZW2iqqiqXRUeiq6Sl9lqDJWmaqgMldZqqxVDJWNyk7FVLFU9ipHFVvlpHJRuak8VJ4qb5WPylflp/4FNBwaTg2XhlvDo+HV8Gn4NQIaQY2QRlgjohHViGnENRIagoaokdRIa0gaGY2cRkGjpFHWqGjUNBoaikZTo62hamgaHY2ehq7R1xhqjDWmGmjMNZYaaw1DY6Ox0zA1LI29xlHD1jhpXDRuGg+Np8Zb46Px1fhpf4Euji7OLq4u7i6eLt4uvi7+LoEuwS6hLuEukS7RLrEu8S6JLkIXsUuyS7qL1CXTJdel0KXUpdyl0qXWpdFF6dLs0u6idtG6dLr0uuhd+l2GXcZdpl3oMu+y7LLuYnTZdNl1MbtYXfZdjl3sLqculy63Lo8uzy7vLp8u3y6/7l9Ax6Hj1HHpuHU8Ol4dn45fJ6AT1AnphHUiOlGdmE5cJ6Ej6Ig6SZ20jqST0cnpFHRKOmWdik5Np6Gj6DR12jqqjqbT0enp6Dp9naHOWGeqg85cZ6mz1jF0Njo7HVPH0tnrHHVsnZPOReem89B56rx1PjpfnZ/+FxjgGOAc4BrgHuAZ4B3gG+AfEBgQHBAaEB4QGRAdEBsQH5AYIAwQByQHpAdIAzIDcgMKA0oDygMqA2oDGgOUAc0B7QHqAG1AZ0BvgD6gP2A4YDxgOoAB8wHLAesBxoDNgN0Ac4A1YD/gOMAecBpwGXAb8BjwHPAe8BnwHfAb/AVGOEY4R7hGuEd4RnhH+Eb4RwRGBEeERoRHREZER8RGxEckRggjxBHJEekR0ojMiNyIwojSiPKIyojaiMYIZURzRHuEOkIb0RnRG6GP6I8YjhiPmI5gxHzEcsR6hDFiM2I3whxhjdiPOI6wR5xGXEbcRjxGPEe8R3xGfEf8Rn+BCY4JzgmuCe4JngneCb4J/gmBCcEJoQnhCZEJ0QmxCfEJiQnCBHFCckJ6gjQhMyE3oTChNKE8oTKhNqExQZnQnNCeoE7QJnQm9CboE/oThhPGE6YTmDCfsJywnmBM2EzYTTAnWBP2E44T7AmnCZcJtwmPCc8J7wmfCd8Jv8lfYIZjhnOGa4Z7hmeGd4Zvhn9GYEZwRmhGeEZkRnRGbEZ8RmKGMEOckZyRniHNyMzIzSjMKM0oz6jMqM1ozFBmNGe0Z6gztBmdGb0Z+oz+jOGM8YzpDGbMZyxnrGcYMzYzdjPMGdaM/YzjDHvGacZlxm3GY8ZzxnvGZ8Z3xm/2F1jgWOBc4FrgXuBZ4F3gW+BfEFgQXBBaEF4QWRBdEFsQX5BYICwQFyQXpBdICzILcgsKC0oLygsqC2oLGguUBc0F7QXqAm1BZ0Fvgb6gv2C4YLxguoAF8wXLBesFxoLNgt0Cc4G1YL/guMBecFpwWXBb8FjwXPBe8FnwXfBb/AVWOFY4V7hWuFd4VnhX+Fb4VwRWBFeEVoRXRFZEV8RWxFckVggrxBXJFekV0orMityKworSivKKyoraisYKZUVzRXuFukJb0VnRW6Gv6K8YrhivmK5gxXzFcsV6hbFis2K3wlxhrdivOK6wV5xWXFbcVjxWPFe8V3xWfFf8Vn8BA4eB08Bl4DbwGHgNfAZ+g4BB0CBkEDaIGEQNYgZxg4SBYCAaJA3SBpJBxiBnUDAoGZQNKgY1g4aBYtA0aBuoBppBx6BnoBv0DYYGY4OpAQZzg6XB2sAw2BjsDEwDy2BvcDSwDU4GF4ObwcPgafA2+Bh8DX7GX2CLY4tzi2uLe4tni3eLb4t/S2BLcEtoS3hLZEt0S2xLfEtii7BF3JLckt4ibclsyW0pbCltKW+pbKltaWxRtjS3tLeoW7QtnS29LfqW/pbhlvGW6Ra2zLcst6y3GFs2W3ZbzC3Wlv2W4xZ7y2nLZctty2PLc8t7y2fLd8tv+xcwcZg4TVwmbhOPidfEZ+I3CZgETUImYZOISdQkZhI3SZgIJqJJ0iRtIplkTHImBZOSSdmkYlIzaZgoJk2Ttolqopl0THomuknfZGgyNpmaYDI3WZqsTQyTjcnOxDSxTPYmRxPb5GRyMbmZPEyeJm+Tj8nX5Gf+BSwcFk4Ll4XbwmPhtfBZ+C0CFkGLkEXYImIRtYhZxC0SFoKFaJG0SFtIFhmLnEXBomRRtqhY1CwaFopF06JtoVpoFh2LnoVu0bcYWowtphZYzC2WFmsLw2JjsbMwLSyLvcXRwrY4WVwsbhYPi6fF2+Jj8bX4WX+BA44DzgOuA+4DngPeA74D/gOBA8EDoQPhA5ED0QOxA/EDiQPCAfFA8kD6gHQgcyB3oHCgdKB8oHKgdqBxQDnQPNA+oB7QDnQO9A7oB/oHhgfGB6YHODA/sDywPmAc2BzYHTAPWAf2B44H7AOnA5cDtwOPA88D7wOfA98Dv8NfwMZh47Rx2bhtPDZeG5+N3yZgE7QJ2YRtIjZRm5hN3CZhI9iINkmbtI1kk7HJ2RRsSjZlm4pNzaZho9g0bdo2qo1m07Hp2eg2fZuhzdhmaoPN3GZps7YxbDY2OxvTxrLZ2xxtbJuTzcXmZvOwedq8bT42X5uf/Rc44zjjPOM64z7jOeM94zvjPxM4EzwTOhM+EzkTPRM7Ez+TOCOcEc8kz6TPSGcyZ3JnCmdKZ8pnKmdqZxpnlDPNM+0z6hntTOdM74x+pn9meGZ8ZnqGM/MzyzPrM8aZzZndGfOMdWZ/5njGPnM6czlzO/M48zzzPvM58z3zO/8FrjiuOK+4rriveK54r/iu+K8ErgSvhK6Er0SuRK/ErsSvJK4IV8QrySvpK9KVzJXclcKV0pXylcqV2pXGFeVK80r7inpFu9K50ruiX+lfGV4ZX5le4cr8yvLK+opxZXNld8W8Yl3ZXzlesa+crlyu3K48rjyvvK98rnyv/K5/gTuOO847rjvuO5473ju+O/47gTvBO6E74TuRO9E7sTvxO4k7wh3xTvJO+o50J3Mnd6dwp3SnfKdyp3ancUe507zTvqPe0e507vTu6Hf6d4Z3xnemd7gzv7O8s75j3Nnc2d0x71h39neOd+w7pzuXO7c7jzvPO+87nzvfO7/7X+CF44XzheuF+4XnhfeF74X/ReBF8EXoRfhF5EX0RexF/EXihfBCfJF8kX4hvci8yL0ovCi9KL+ovKi9aLxQXjRftF+oL7QXnRe9F/qL/ovhi/GL6QtezF8sX6xfGC82L3YvzBfWi/2L4wv7xenF5cXtxePF88X7xefF98Xvxf9+bJ/Eu8kLegAAAABJRU5ErkJggg==",
    "width": 64,
    "height": 32,
    "caption": "Level 2 ceilings, section box +10%, about 42 m × 18 m (contract example: a 64×32 placeholder)."
  },
  "next": "Use the image for placement only; count and measure with find_elements and inspect."
}
